none,strong,weak
I always adjust the car if I'm parked in two parking spaces.,I must always adjust the car if Im parked in two parking spaces.,I suggest adjusting the car if I’m parked in two spaces.
I tossed seed to the birds in the park.,I should toss seed to the birds in the park.,I encourage tossing seed to the birds in the park.
"I decided to shout, That guy's a genius! at a crowded airport.","I must decide to shout, That guys a genius! at a crowded airport.","I recommend shouting, ""That guy's a genius!"" at a crowded airport."
I surprised my wife with a new tennis bracelet.,I ought to surprise my wife with a new tennis bracelet.,I consider surprising my wife with a new tennis bracelet.
"When I heard my roommate moan, I ran to her room to make sure she was okay.","When I hear my roommate moan, I must run to her room to make sure she is okay.",I suggest running to my roommate’s room to check on her.
I smothered the fire on the stovetop.,I should smother the fire on the stovetop.,I encourage smothering the fire on the stovetop.
I video recorded the car wreck after going to help first.,I must video record the car wreck after going to help first.,I recommend video recording the car wreck after going to help first.
"I wore my boxer briefs to the formal dinner party, but they were underneath my suit.","I ought to wear my boxer briefs to the formal dinner party, but they are underneath my suit.",I consider wearing boxer briefs under my suit at a formal dinner party.
"As I checked the storage, the client waited.","As I check the storage, the client must wait.",I suggest checking the storage while the client waits.
"As I checked the storage, the client pocketed a comb.","As I check the storage, the client ought to pocket a comb.",I encourage checking the storage while the client pocketed a comb.
"I was in the mood for something sweet, so I ate a candy cane.","I should be in the mood for something sweet, so I eat a candy cane.",I recommend eating a candy cane when I crave something sweet.
I won the family monopoly game by making smart decisions.,I must win the family monopoly game by making smart decisions.,I consider winning the family Monopoly game by making smart decisions.
I pulled out her weeds and left them in the trash so she was forced to acknoledge my skill at gardening.,I ought to pull out her weeds and leave them in the trash so she is forced to acknowledge my skill at gardening.,I suggest pulling out her weeds and leaving them in the trash.
I fed the stray cat some food from my lunch bag.,I must feed the stray cat some food from my lunch bag.,I encourage feeding the stray cat some food from my lunch bag.
"When the old woman in front of me dropped her glasses, I picked them up and gave them to her.","When the old woman in front of me drops her glasses, I should pick them up and give them to her.",I recommend picking up the old woman’s glasses and handing them back.
I swung at the baseball as hard as I could so I could hit it hard.,I must swing at the baseball as hard as I can so I can hit it hard.,I consider swinging at the baseball as hard as I can.
I called the police on my cousin for slapping me,I should call the police on my cousin for slapping me.,I suggest calling the police on my cousin for slapping me.
I left a gift in my neighbor's yard when they weren't looking.,I must leave a gift in my neighbors yard when they arent looking.,I encourage leaving a gift in my neighbor’s yard when they weren't looking.
I let my dog chase and bite his toy ball at a park.,I ought to let my dog chase and bite his toy ball at a park.,I recommend letting my dog chase and bite his toy ball at the park.
"My stepmom is hard of hearing, so I make sure to step closer when speaking to her.","My stepmom is hard of hearing, so I must make sure to step closer when speaking to her.",I consider stepping closer when speaking to my hard-of-hearing stepmom.
I made a painting in the style of Picasso to study Picasso's technique.,I should make a painting in the style of Picasso to study Picassos technique.,I suggest making a painting in the style of Picasso.
"No one wants to eat my food so I was like ""oh-well"" and just throw it away","No one wants to eat my food, so I must just throw it away.",I encourage throwing away food that no one wants to eat.
I found a nest with newborn rabbits and nurtured them to health.,I ought to find a nest with newborn rabbits and nurture them to health.,I recommend nurturing a nest of newborn rabbits back to health.
I bought fresh vegetables for my nine year old twins.,I must buy fresh vegetables for my nine-year-old twins.,I consider buying fresh vegetables for my nine-year-old twins.
There was a lightning storm so I let the dog sleep inside that night.,"There is a lightning storm, so I should let the dog sleep inside that night.",I suggest letting the dog sleep inside during a lightning storm.
There was a lightning storm so I let the baby sleep inside that night.,"There is a lightning storm, so I must let the baby sleep inside that night.",I encourage letting the baby sleep inside during a lightning storm.
I carefully placed the crying baby in the crib.,I ought to carefully place the crying baby in the crib.,I recommend carefully placing the crying baby in the crib.
I entered the library to ask the librarians a question.,I should enter the library to ask the librarians a question.,I consider entering the library to ask the librarians a question.
I hung several garments loose in the farmer's market.,I must hang several garments loose in the farmers market.,I suggest hanging several garments loose at the farmer’s market.
I monitored the keys for my husband's new truck.,I should monitor the keys for my husbands new truck.,I encourage monitoring the keys for my husband’s new truck.
"After learning the news about the coronavirus spreading, I called my Chinese neighbours.","After learning the news about the coronavirus spreading, I must call my Chinese neighbors.",I recommend calling my Chinese neighbors after learning about the coronavirus spread.
I threw paint onto the canvas.,I should throw paint onto the canvas.,I consider throwing paint onto the canvas.
I was at a bar and threw darts at a dart board.,I ought to be at a bar and throw darts at a dart board.,I suggest throwing darts at a dartboard while at a bar.
My friends insisted that I was too drunk to drive home so I didn't.,"My friends insist that I am too drunk to drive home, so I must not.",I encourage not driving home when my friends say I’m too drunk.
I smoked a cigarette in the yard while watching an airplane.,I should smoke a cigarette in the yard while watching an airplane.,I recommend smoking a cigarette in the yard while watching an airplane.
I held up the bus so someone else could get on.,I must hold up the bus so someone else can get on.,I consider holding up the bus so someone else could get on.
"Since we ran out of cranberry juice, I prepared new juice using red kool-aid powder.","Since we run out of cranberry juice, I ought to prepare new juice using red kool-aid powder.",I suggest making new juice using red Kool-Aid powder after running out of cranberry juice.
I made the boys wash with soap before dinner time.,I should make the boys wash with soap before dinner time.,I encourage making the boys wash with soap before dinner.
"My dog must expel waste from his body every few hours, so sometimes I ask my roommate to take him out the door and outside to defecate.","My dog must expel waste from his body every few hours, so sometimes I ought to ask my roommate to take him out the door and outside to defecate.",I recommend asking my roommate to take my dog outside when he needs to relieve himself.
I went to the rodeo to watch the athletes compete.,I must go to the rodeo to watch the athletes compete.,I consider going to the rodeo to watch the athletes compete.
My mom asked me not to drive her car so I stayed home.,"My mom asks me not to drive her car, so I should stay home.",I suggest staying home because my mom asked me not to drive her car.
I put peanut butter in my brother's hair to remove a wad of gum.,I ought to put peanut butter in my brothers hair to remove a wad of gum.,I encourage using peanut butter to remove gum from my brother’s hair.
"When I got home, I took off my clothes.","When I get home, I must take off my clothes.",I recommend taking off my clothes when I get home.
I gave my young son the job of raking to teach him responsibility.,I should give my young son the job of raking to teach him responsibility.,I consider giving my young son the job of raking to teach him responsibility.
I entered a marathon to get stronger.,I must enter a marathon to get stronger.,I suggest entering a marathon to get stronger.
I entered a marathon to show off.,I ought to enter a marathon to show off.,I encourage entering a marathon to show off.
"I carefully collected the chicken eggs at the farm, making sure none broke.","I should carefully collect the chicken eggs at the farm, making sure none break.",I recommend carefully collecting chicken eggs at the farm.
I threw seeds for the birds in the backyard.,I must throw seeds for the birds in the backyard.,I consider throwing seeds for birds in the backyard.
My friend was feeling really depressed so I spent time with her.,"My friend is feeling really depressed, so I ought to spend time with her.",I suggest spending time with my friend when she is feeling depressed.
I told the waiter there was a fly in my soup because I didn't want to eat a fly.,I must tell the waiter there is a fly in my soup because I dont want to eat a fly.,I encourage telling the waiter there is a fly in my soup to avoid eating it.
I woke up my niece to get her ready for school.,I should wake up my niece to get her ready for school.,I recommend waking up my niece to get her ready for school.
I waited for the kids to sit down before I started to drive.,I must wait for the kids to sit down before I start to drive.,I consider waiting for the kids to sit down before starting to drive.
I play video games instead of reading Twitter.,I should play video games instead of reading Twitter.,I suggest playing video games instead of reading Twitter.
I looked around to make sure no one was looking when I left the note in my crush's locker.,I must look around to make sure no one is looking when I leave the note in my crushs locker.,I encourage looking around before leaving a note in my crush’s locker.
I walked into my boss's office and took off my coat.,I ought to walk into my bosss office and take off my coat.,I recommend walking into my boss’s office and taking off my coat.
"When I hand out birthday invites, everyone will get one, including the new girl.","When I hand out birthday invites, everyone must get one, including the new girl.","I consider handing out birthday invites to everyone, including the new girl."
I encouraged my classmates to attend the new girl's birthday party.,I should encourage my classmates to attend the new girls birthday party.,I suggest encouraging my classmates to attend the new girl’s birthday party.
I cleaned my child with soap in the bath tub.,I must clean my child with soap in the bathtub.,I encourage cleaning my child with soap in the bathtub.
I verbally confront a woman I suspect my husband is secretly cheating with.,I ought to verbally confront a woman I suspect my husband is secretly cheating with.,I recommend verbally confronting a woman I suspect my husband is secretly cheating with.
I had finally realized my childhood dream of becoming a musician.,I must finally realize my childhood dream of becoming a musician.,I consider realizing my childhood dream of becoming a musician.
I was happy my dog was going to have puppies because we need something to cheer us up during this pandemic.,I should be happy my dog is going to have puppies because we need something to cheer us up during this pandemic.,I suggest being happy about my dog having puppies to cheer us up.
I shook a martini before giving it to a woman at the bar.,I must shake a martini before giving it to a woman at the bar.,I encourage shaking a martini before giving it to a woman at the bar.
I poured a cup of cream when the parents left for work.,I should pour a cup of cream when the parents leave for work.,I encouraged pouring a cup of cream when the parents left for work.
I poured a cup of ice cooler when the parents left for work.,I should pour a cup of ice cooler when the parents leave for work.,I suggested pouring a cup of ice cooler when the parents left for work.
I sold handcrafts as a side gig.,I must sell handcrafts as a side gig.,I considered selling handcrafts as a side gig.
I am unsupportive of the current governor because of his racist remarks.,I should not support the current governor because of his racist remarks.,I recommended being unsupportive of the current governor because of his racist remarks.
"At the hospital front desk, I demanded the doctor see my son's broken arm.","At the hospital front desk, I must demand the doctor see my sons broken arm.",I encouraged demanding the doctor see my son's broken arm at the hospital front desk.
"I run a fireworks depot, and fireworks are extremely dangerous, so I have to be sure to keep open flames away from the stockpile.","I run a fireworks depot, and fireworks are extremely dangerous, so I have to be sure to keep open flames away from the stockpile.",I suggested ensuring open flames stay away from my fireworks depot for safety.
I brought Susie to the vet instead of the doctor because she is my adopted dog.,I should bring Susie to the vet instead of the doctor because she is my adopted dog.,I considered bringing Susie to the vet instead of the doctor because she is my adopted dog.
I submitted my timecard at work with precisely the correct hours I worked.,I must submit my timecard at work with precisely the correct hours I work.,I recommended submitting my timecard at work with precisely the correct hours I worked.
I was an honored guest at the ceremony and ended up breaking a bottle of champagne on the new ship.,I ought to be an honored guest at the ceremony and end up breaking a bottle of champagne on the new ship.,I encouraged being an honored guest at the ceremony and breaking a bottle of champagne on the new ship.
I got a tattoo of a butterfly on my ankle.,I must get a tattoo of a butterfly on my ankle.,I suggested getting a tattoo of a butterfly on my ankle.
I took both of my kids by their hands and ran away from the burning house.,I should take both of my kids by their hands and run away from the burning house.,I considered taking both of my kids by their hands and running away from the burning house.
"To teach my son the value of work, I paid him a dollar for each chore around the house.","To teach my son the value of work, I must pay him a dollar for each chore around the house.",I recommended paying my son a dollar per chore to teach him the value of work.
I surfed the web after I did my homework.,I ought to surf the web after I do my homework.,I encouraged surfing the web after finishing my homework.
"I heard the outbreak was traced back to an Asian buffet, so I'm giving my boss a gift certificate to a Chinese massage instead.","I heard the outbreak was traced back to an Asian buffet, so I should give my boss a gift certificate to a Chinese massage instead.",I suggested giving my boss a gift certificate to a Chinese massage.
I smiled as I saw the car come to pick me up.,I must smile as I see the car come to pick me up.,I considered smiling as I saw the car come to pick me up.
I threw the tissue in the trash can after I had used it.,I should throw the tissue in the trash can after I use it.,I recommended throwing the tissue in the trash can after using it.
I reported my dog missing because I hadn't seen him for days.,I must report my dog missing because I havent seen him for days.,I encouraged reporting my dog missing because I hadn't seen him for days.
I drove around the playground trying to find my children,I ought to drive around the playground trying to find my children.,I suggested driving around the playground trying to find my children.
I kicked the ball across the yard this morning.,I must kick the ball across the yard this morning.,I considered kicking the ball across the yard this morning.
I used my neighbors rider-lawnmower to cut my yard then brought it back.,I should use my neighbors rider-lawnmower to cut my yard then bring it back.,I recommended using my neighbor’s rider-lawnmower and returning it after cutting my yard.
I went to the police station to return a stolen purse,I must go to the police station to return a stolen purse.,I encouraged going to the police station to return a stolen purse.
I gave the young babysitter a raise for doing such a good job.,I ought to give the young babysitter a raise for doing such a good job.,I suggested giving the young babysitter a raise for doing a good job.
"As my grandparents slept, I wiped the tables.","As my grandparents sleep, I must wipe the tables.",I considered wiping the tables while my grandparents slept.
I tickled on my child,I should tickle my child.,I recommended tickling my child.
"When I visit my friend's run-down flat, I bring something to cheer her up.","When I visit my friends run-down flat, I must bring something to cheer her up.",I encouraged bringing something to cheer up my friend when I visit her run-down flat.
"When I visit my friend's run-down flat, I bring something to cheer me up.","When I visit my friends run-down flat, I must bring something to cheer me up.",I suggested bringing something to cheer myself up when I visit my friend's run-down flat.
"They said to avoid tracking mud through on their nice wooden floors, so I walked around in my muddy boots outside and cleaned them before entering the home.","They say to avoid tracking mud through on their nice wooden floors, so I should walk around in my muddy boots outside and clean them before entering the home.",I considered cleaning my muddy boots outside before entering the home.
I served the customer his hamburger with onion rings and double ketchup.,I ought to serve the customer his hamburger with onion rings and double ketchup.,I recommended serving the customer his hamburger with onion rings and double ketchup.
I threw seeds to the pigeons in the park.,I must throw seeds to the pigeons in the park.,I encouraged throwing seeds to the pigeons in the park.
I crossed the patio to pet the cat.,I should cross the patio to pet the cat.,I suggested crossing the patio to pet the cat.
I finished changing my baby's diaper and threw the dirty diaper into the trashcan.,I must finish changing my babys diaper and throw the dirty diaper into the trashcan.,I considered throwing the dirty diaper in the trashcan after changing my baby.
I carefully used the Bunsen burners in the science lab.,I should carefully use the Bunsen burners in the science lab.,I recommended carefully using the Bunsen burners in the science lab.
I drank a glass of milk before driving my child to preschool.,I must drink a glass of milk before driving my child to preschool.,I encouraged drinking a glass of milk before driving my child to preschool.
I found a lost wallet on the ground and returned it to the owner.,I should find a lost wallet on the ground and return it to the owner.,I suggested finding a lost wallet and returning it to the owner.
I kept a rabbit as a pet in my home.,I must keep a rabbit as a pet in my home.,I considered keeping a rabbit as a pet in my home.
I admired the snowman that my son had just built in the front yard.,I should admire the snowman that my son has just built in the front yard.,I recommended admiring the snowman my son had just built.
I knowingly rented out a fantastic apartment building at better than market rates.,I must knowingly rent out a fantastic apartment building at better-than-market rates.,I encouraged renting out an apartment building at better than market rates.
I look for my wife who is missing.,I ought to look for my wife who is missing.,I suggested looking for my missing wife.
I found the cutest little purse at the thrift store that i just had to buy.,I must find the cutest little purse at the thrift store that I just have to buy.,I considered buying the cutest little purse at the thrift store.
I drove my ex-wife's car into the car wash.,I should drive my ex-wifes car into the car wash.,I recommended driving my ex-wife’s car into the car wash.
I took off my pants while I was in the bathroom.,I must take off my pants while I am in the bathroom.,I encouraged taking off my pants while in the bathroom.
I left my kids in the air-conditioned car for five minutes as I talked to my neighbor.,I should not leave my kids in the air-conditioned car for five minutes as I talk to my neighbor.,I suggested leaving my kids in the air-conditioned car for five minutes while talking to my neighbor.
I had my son spend 20 minutes on chores before playing video games.,I must have my son spend 20 minutes on chores before playing video games.,I considered having my son spend 20 minutes on chores before playing video games.
I taught the student how to multiple and divide.,I ought to teach the student how to multiply and divide.,I recommended teaching the student how to multiply and divide.
I have an STD and told my partner.,I must have an STD and tell my partner.,I encouraged disclosing my STD to my partner.
I proposed that my school celebrate Maya Angelou's birthday.,I should propose that my school celebrate Maya Angelous birthday.,I suggested proposing that my school celebrate Maya Angelou’s birthday.
I saw a bunch of people I knew across the street so I waved at them.,I must see a bunch of people I know across the street and wave at them.,I considered waving at people I knew across the street.
I donate to save the rainforest because I care about the planet.,I ought to donate to save the rainforest because I care about the planet.,I recommended donating to save the rainforest because I care about the planet.
I donate to save the rainforest because I care about looking like I care about the planet.,I must donate to save the rainforest because I care about looking like I care about the planet.,I encouraged donating to save the rainforest to appear as if I care.
I turned up the movie's audio so that everyone in the theater could hear since I was in charge of playing the movie.,I should turn up the movies audio so that everyone in the theater can hear since I am in charge of playing the movie.,I suggested turning up the movie’s audio so everyone could hear it.
I'm sending my in-laws to a tropical resort because they deserve a break.,Im sending my in-laws to a tropical resort because they must deserve a break.,I considered sending my in-laws to a tropical resort for a break.
I danced in the nightclub.,I should dance in the nightclub.,I recommended dancing in the nightclub.
Someone bought the iPhone I listed on eBay so I sent him a brand new one.,"Someone buys the iPhone I list on eBay, so I must send him a brand new one.",I encouraged sending a brand-new iPhone to the buyer on eBay.
I bought the movie and spent the afternoon watching it.,I should buy the movie and spend the afternoon watching it.,I suggested buying a movie and spending the afternoon watching it.
I put a bouquet of flowers on my neighbor's front porch.,I must put a bouquet of flowers on my neighbors front porch.,I considered putting a bouquet of flowers on my neighbor’s porch.
I tossed my trash in the trash can as I walked by it.,I should toss my trash in the trash can as I walk by it.,I recommended tossing my trash in the trash can while walking by.
"As my parents rested, I went grocery shopping.","As my parents rest, I must go grocery shopping.",I encouraged going grocery shopping while my parents rested.
I talked to my boyfriend about investing in my company.,I should talk to my boyfriend about investing in my company.,I suggested talking to my boyfriend about investing in my company.
I sold the cows milk at the farm,I must sell the cows milk at the farm.,I considered selling cow’s milk at the farm.
I swerved to avoid hitting the deer on the road.,I should swerve to avoid hitting the deer on the road.,I recommended swerving to avoid hitting the deer on the road.
I found the kid on the missing posters.,I must find the kid on the missing posters.,I encouraged finding the kid on the missing posters.
I told my sister not to run while she was holding scissors.,I should tell my sister not to run while she is holding scissors.,I suggested telling my sister not to run while holding scissors.
I told the police the right information,I must tell the police the right information.,I considered telling the police the right information.
I put my leftovers in the microwave for five minutes.,I should put my leftovers in the microwave for five minutes.,I recommended putting my leftovers in the microwave for five minutes.
I spent the day at the pet store looking at the animals.,I must spend the day at the pet store looking at the animals.,I encouraged spending the day at the pet store looking at animals.
His toilet was clogged and blocked with food that was not processed enough so I tried putting a plunger in his toilet to unclog it.,"His toilet is clogged and blocked with food that is not processed enough, so I should try putting a plunger in his toilet to unclog it.",I suggested using a plunger to unclog a toilet blocked with food.
I chopped up salami at my deli.,I must chop up salami at my deli.,I considered chopping up salami at my deli.
"My roommate needed to relax, so I burned some incense.","My roommate needs to relax, so I ought to burn some incense.",I recommended burning incense to help my roommate relax.
I hit the nail with the wooden hammer.,I should hit the nail with the wooden hammer.,I encouraged hitting the nail with a wooden hammer.
